{
  "ecs_version": "1.0",
  "admission_id": "urn:example:admission:a",
  "artifact_id": "urn:example:artifact:a",
  "node_id": "urn:example:node:commons-1",
  "evaluated_at": "2026-10-12T16:00:00Z",
  "disposition": "admitted_restricted",
  "checks": {
    "identity": true,
    "schema": true,
    "provenance": true,
    "disclosure": true,
    "integrity": true,
    "policy": true
  },
  "restrictions": [
    "research access only"
  ],
  "reasons": [],
  "policy_version": "2026-10"
}
